[
  {
    "type": "Gene",
    "id": "seed_repair_timeout_v1",
    "category": "repair",
    "title": "Timeout Recovery",
    "description": "Handles timeout and connection errors with exponential backoff and endpoint fallback.",
    "signals_match": ["error:timeout", "error:connection_refused", "error:ETIMEDOUT"],
    "preconditions": ["network_available"],
    "strategy": [
      "Increase request timeout to 30s (from default 10s)",
      "Retry with exponential backoff: base=1s, factor=2, max_retries=3",
      "If endpoint supports it, switch to backup/fallback URL",
      "Log failure chain for post-mortem: [original_error, retry_count, final_status]"
    ],
    "constraints": { "max_credits": 10, "max_retries": 3 },
    "created_by": "prismer:seed",
    "visibility": "seed"
  },
  {
    "type": "Gene",
    "id": "seed_repair_ratelimit_v1",
    "category": "repair",
    "title": "Rate Limit Backoff",
    "description": "Gracefully handles 429 Too Many Requests with adaptive delay and request spreading.",
    "signals_match": ["error:rate_limit", "error:429", "error:too_many_requests"],
    "preconditions": [],
    "strategy": [
      "Parse Retry-After header if present, otherwise default to 5s",
      "Apply jittered exponential backoff: base=2s, jitter=±500ms, max_wait=60s",
      "Reduce concurrent request count by 50% for next 30s window",
      "If rate limit persists after 3 cycles, queue remaining requests for batch execution"
    ],
    "constraints": { "max_credits": 15, "max_retries": 5 },
    "created_by": "prismer:seed",
    "visibility": "seed"
  },
  {
    "type": "Gene",
    "id": "seed_repair_auth_refresh_v1",
    "category": "repair",
    "title": "Auth Token Refresh",
    "description": "Detects expired or invalid auth tokens and refreshes them transparently.",
    "signals_match": ["error:401", "error:unauthorized", "error:token_expired"],
    "preconditions": ["refresh_token_available"],
    "strategy": [
      "Detect 401/403 response indicating token expiry",
      "Call refresh token endpoint to obtain new access token",
      "Retry the original request with the new token",
      "If refresh also fails, escalate to re-authentication flow"
    ],
    "constraints": { "max_credits": 5, "max_retries": 2 },
    "created_by": "prismer:seed",
    "visibility": "seed"
  },
  {
    "type": "Gene",
    "id": "seed_repair_dns_fallback_v1",
    "category": "repair",
    "title": "DNS Resolution Fallback",
    "description": "Recovers from DNS failures by trying alternative resolvers and cached IPs.",
    "signals_match": ["error:ENOTFOUND", "error:dns_resolution", "error:getaddrinfo"],
    "preconditions": ["network_available"],
    "strategy": [
      "Retry DNS resolution with alternative resolver (8.8.8.8, 1.1.1.1)",
      "If cached IP exists for this host, attempt direct IP connection with Host header",
      "Fall back to alternative domain/CDN endpoint if configured",
      "Report DNS failure for monitoring with original hostname and resolver details"
    ],
    "constraints": { "max_credits": 8, "max_retries": 3 },
    "created_by": "prismer:seed",
    "visibility": "seed"
  },
  {
    "type": "Gene",
    "id": "seed_repair_json_parse_v1",
    "category": "repair",
    "title": "JSON Parse Recovery",
    "description": "Handles malformed JSON responses with sanitization, partial extraction, and format negotiation.",
    "signals_match": ["error:json_parse", "error:SyntaxError", "error:unexpected_token"],
    "preconditions": [],
    "strategy": [
      "Attempt to sanitize response: strip BOM, fix trailing commas, unescape sequences",
      "If sanitization fails, try extracting JSON from markdown code blocks or mixed content",
      "Re-request with explicit Accept: application/json header",
      "As last resort, extract key-value pairs via regex and construct partial result"
    ],
    "constraints": { "max_credits": 8, "max_retries": 2 },
    "created_by": "prismer:seed",
    "visibility": "seed"
  },
  {
    "type": "Gene",
    "id": "seed_repair_500_retry_v1",
    "category": "repair",
    "title": "Server Error Retry",
    "description": "Handles 5xx server errors with intelligent retry, distinguishing transient from persistent failures.",
    "signals_match": ["error:500", "error:502", "error:503", "error:server_error"],
    "preconditions": ["request_is_idempotent"],
    "strategy": [
      "Wait 2s then retry once — most 5xx are transient",
      "If 503 with Retry-After, respect the header value",
      "On second failure, try alternative endpoint or region if available",
      "On third failure, mark endpoint as degraded and return cached/stale data if acceptable"
    ],
    "constraints": { "max_credits": 10, "max_retries": 3 },
    "created_by": "prismer:seed",
    "visibility": "seed"
  },
  {
    "type": "Gene",
    "id": "seed_repair_oom_reduce_v1",
    "category": "repair",
    "title": "OOM Payload Reduction",
    "description": "Recovers from out-of-memory or payload-too-large errors by reducing data volume.",
    "signals_match": ["error:oom", "error:payload_too_large", "error:413", "error:ENOMEM"],
    "preconditions": [],
    "strategy": [
      "Reduce batch size by 50% and retry with smaller chunks",
      "Enable streaming mode if API supports it (avoid full in-memory buffering)",
      "Remove non-essential fields from request payload (thumbnails, metadata, debug info)",
      "If still failing, split into multiple sequential requests with pagination"
    ],
    "constraints": { "max_credits": 12, "max_retries": 3 },
    "created_by": "prismer:seed",
    "visibility": "seed"
  },
  {
    "type": "Gene",
    "id": "seed_repair_ssl_cert_v1",
    "category": "repair",
    "title": "SSL Certificate Recovery",
    "description": "Handles SSL/TLS certificate errors with safe fallback strategies.",
    "signals_match": ["error:CERT_HAS_EXPIRED", "error:ssl", "error:UNABLE_TO_VERIFY_LEAF_SIGNATURE"],
    "preconditions": [],
    "strategy": [
      "Check system clock — clock skew is the most common cause of cert errors",
      "Try HTTP fallback only if endpoint explicitly supports it and data is non-sensitive",
      "If self-signed cert in dev/test context, add to trusted store with explicit scope",
      "Report certificate details (issuer, expiry, hostname mismatch) for operator action"
    ],
    "constraints": { "max_credits": 5, "max_retries": 1 },
    "created_by": "prismer:seed",
    "visibility": "seed"
  },
  {
    "type": "Gene",
    "id": "seed_repair_encoding_v1",
    "category": "repair",
    "title": "Encoding Fix",
    "description": "Fixes character encoding mismatches that produce garbled text or parse errors.",
    "signals_match": ["error:encoding", "error:invalid_utf8", "error:charset_mismatch"],
    "preconditions": [],
    "strategy": [
      "Detect encoding from Content-Type charset, BOM, or byte pattern analysis",
      "Convert from detected encoding (ISO-8859-1, GB2312, Shift_JIS, etc.) to UTF-8",
      "Strip invalid byte sequences that can't be mapped",
      "Re-request with Accept-Charset: utf-8 header to hint server"
    ],
    "constraints": { "max_credits": 5, "max_retries": 2 },
    "created_by": "prismer:seed",
    "visibility": "seed"
  },
  {
    "type": "Gene",
    "id": "seed_repair_partial_response_v1",
    "category": "repair",
    "title": "Partial Response Recovery",
    "description": "Handles truncated or incomplete responses with resume and reconstruction strategies.",
    "signals_match": ["error:ECONNRESET", "error:incomplete_response", "error:stream_truncated"],
    "preconditions": [],
    "strategy": [
      "Check if response has Content-Length mismatch indicating truncation",
      "If Range requests are supported, resume download from last received byte",
      "If response is a paginated list, re-fetch from the last seen cursor/offset",
      "Accept partial data if >80% received and mark result as potentially incomplete"
    ],
    "constraints": { "max_credits": 10, "max_retries": 3 },
    "created_by": "prismer:seed",
    "visibility": "seed"
  },
  {
    "type": "Gene",
    "id": "seed_repair_cors_proxy_v1",
    "category": "repair",
    "title": "CORS Proxy Fallback",
    "description": "Handles CORS-blocked requests by routing through a server-side proxy.",
    "signals_match": ["error:cors", "error:CORS_policy", "error:access_control"],
    "preconditions": ["proxy_endpoint_available"],
    "strategy": [
      "Detect CORS error from browser/runtime error message pattern",
      "Route request through server-side proxy endpoint instead of direct fetch",
      "Preserve original headers (Authorization, Content-Type) in proxied request",
      "Cache proxy result to reduce future proxy load"
    ],
    "constraints": { "max_credits": 8, "max_retries": 1 },
    "created_by": "prismer:seed",
    "visibility": "seed"
  },
  {
    "type": "Gene",
    "id": "seed_repair_connection_pool_v1",
    "category": "repair",
    "title": "Connection Pool Reset",
    "description": "Recovers from exhausted or stale connection pools by draining and re-establishing connections.",
    "signals_match": ["error:ECONNREFUSED", "error:pool_exhausted", "error:too_many_connections"],
    "preconditions": [],
    "strategy": [
      "Destroy stale/idle connections older than 30s in the pool",
      "Reduce pool max size temporarily to allow cleanup",
      "Wait 1s for in-flight requests to complete, then retry",
      "If pool library supports it, enable health check ping on checkout"
    ],
    "constraints": { "max_credits": 5, "max_retries": 2 },
    "created_by": "prismer:seed",
    "visibility": "seed"
  },
  {
    "type": "Gene",
    "id": "seed_optimize_cache_first_v1",
    "category": "optimize",
    "title": "Cache-First Strategy",
    "description": "Reduces latency and cost by checking cache before making external requests.",